{"format":"mithril.computable-segments/reference-v1","tupleDigest":"sha256:1a5f74394c63cb9405859530a8bbcf482f3442423c247ae4d135bebe00f020d1","canonicalGraphDigest":null,"emptyGraphs":[["I","urn:empty"]],"count":0,"segments":[],"physicalDigest":"sha256:69b701b7fbc5eb0abea142ef169a69b1160a0a60b8b2eef7eebb48e74f847c9c"}
