{"format":"mithril.computable-segments/reference-v1","tupleDigest":"sha256:0435104593174312601ae0e15c59d9ff1909fe514cf33c0d0459d5737d48db68","canonicalGraphDigest":null,"emptyGraphs":[["I","urn:empty"]],"count":300,"segments":[{"kind":"model","codec":"zstd","rawBytes":523,"count":300,"min":"[\"I\",\"urn:s:0\"]","max":"[\"I\",\"urn:s:99\"]","subjectRange":{"kind":"range","prefix":"urn:s:","start":0,"count":100},"digest":"sha256:87f45b1965f7bf5258a0b125078bbc7f4689959df698d64b6e7b811cac1d2008","bytes":"KLUv/WALAeUGAOINKiBgaaoDg/j2X8hZSvUSs5M8fZifdzKOCTNA62MEBQBwXA1+rJVVjF0rJTpCQOMunlv4RKvYYgdWUWhNwc8jzGBHgOQ2UQaJgoPjYAziQOAzBCyGZVmOQ5Xu5Pm1MCWJn+zITzUn3k6EjiQy+ZaYLfh+Ep3zBD/n6ON2aorbfjaMOeibFU89jb5h6vi8RmWouJ7BEBYqzy/CCeqZJffW823Xc9cvZglfCBIgEMYod6udZ5mZOhrY1RPo+Ex1efa6QAKQzsMkREAM8SwBl6aK8jTas2GwbDHWyhg="}],"physicalDigest":"sha256:613fc153e305ca0db440bf20b2de1697591f630e9279d38ef95ff031cfc07ff2"}
